{
  "$schema": "aura-mcp-tool-v1",
  "name": "google-calendar",
  "version": "0.1.0",
  "description": "Read/create/update Google Calendar events (Phase 2 \u2014 not yet implemented)",
  "type": "hermes_connector",
  "executor_service": "hermes",
  "executor_endpoint": "/tools/execute",
  "input_schema": {
    "type": "object",
    "properties": {},
    "required": []
  },
  "output_schema": {
    "type": "object",
    "properties": {}
  },
  "auth": {
    "type": "api_key",
    "key_env": "GOOGLE_CALENDAR_API_KEY"
  },
  "rate_limit": {
    "requests_per_minute": 30
  },
  "health_check": {
    "method": "GET",
    "path": "/tools/health/google-calendar"
  },
  "phase": 2,
  "status": "placeholder",
  "future_mcp_standard": {
    "protocol": "mcp-v1",
    "transport": "streamable-http",
    "note": "Phase 2 tool \u2014 google-calendar connector will be implemented in Phase 2"
  }
}